season,episode_num,title,original_air_date,imdb_rating,total_votes,desc
11,13,The Solo Oscillation,11 Jan. 2018,7.2,2016,"Sheldon kicks Amy out of the apartment to work solo, and she and Leonard end up bonding during a series of science experiments; Howard is replaced by Bert in Footprints on the Moon."
11,14,The Separation Triangulation,18 Jan. 2018,7.2,2050,"Raj meets a girl at the Planetarium, but soon after finds out she is married. Sheldon rents out his old room to use for his work."
11,15,The Novelization Correlation,1 Feb. 2018,7.5,2003,"Leonard's book raises questions, and Amy guest stars on the new Professor Proton show."
11,16,The Neonatal Nomenclature,1 Mar. 2018,7.1,1942,"When Bernadette won't go into labor, the gang try different tactics to get things started. Also, Wolowitz confronts Bernadette after Amy accidentally reveals she's already chosen their son's name."
11,17,The Athenaeum Allocation,8 Mar. 2018,6.8,1957,"Leonard jumps through hoops to help secure the perfect wedding venue for Sheldon and Amy. Also, Bernadette and Wolowitz have a hard time deciding who should stay at home with the kids and who should go back to work."
11,18,The Gates Excitation,29 Mar. 2018,7.1,1987,"Leonard, Howard and Raj try to meet Bill Gates, who's meeting with Penny to merge their companies; Sheldon thinks he's the victim of an April Fool's prank."
11,19,The Tenant Disassociation,5 Apr. 2018,7.2,1943,Leonard runs against Sheldon to be president of the tenants association; Wolowitz and Koothrappali find a drone in the backyard.
11,20,The Reclusive Potential,12 Apr. 2018,7.2,1938,Sheldon takes the guys to a cabin in the middle of nowhere to meet a reclusive scientist; Penny and Bernadette improvise Amy's bachelorette party.
11,21,The Comet Polarization,19 Apr. 2018,7.4,1930,Sheldon's comic book store experience changes when writer Neil Gaiman puts Stuart's store on the map; friendships are threatened when Koothrappali takes credit for Penny's astronomical discovery.
11,22,The Monetary Insufficiency,26 Apr. 2018,7.2,1898,"Sheldon goes to Vegas to win money for science. Also, Penny and Bernadette take Amy wedding dress shopping, but her terrible choice entangles them in a web of lies."
11,23,The Sibling Realignment,3 May 2018,7.7,2036,Sheldon and Leonard make a road trip to wrangle a reluctant wedding guest.
11,24,The Bow Tie Asymmetry,10 May 2018,9.0,3543,"When Amy's parents and Sheldon's family arrive, everybody is focused to make sure all wedding arrangements go according to plan - everyone except the bride and groom."
12,1,The Conjugal Configuration,24 Sep. 2018,7.2,2324,"After their wedding, Amy and Sheldon go on their honeymoon."
12,2,The Wedding Gift Wormhole,27 Sep. 2018,7.6,2205,Leonard and Penny give Sheldon and Amy a baffling wedding gift.
12,3,The Procreation Calculation,4 Oct. 2018,7.2,2098,"The Wolowitzes' life gets complicated when Stuart starts bringing his new girlfriend home. Also, Penny and Leonard talk about starting a family while Koothrappali explores an arranged marriage."
12,4,The Tam Turbulence,11 Oct. 2018,7.0,2025,"Sheldon won't tell anyone why he's never mentioned Tam, his childhood best friend, so Leonard takes matters into his own hands. Also, Bernadette and Penny take out Raj's fiancée, Anu, for dinner to get the skinny on her."
12,5,The Planetarium Collision,18 Oct. 2018,6.8,2021,"Amy doesn't have time to work with Sheldon on super asymmetry, so he goes to great lengths to ensure she's available. Koothrappali doesn't want Wolowitz to join him in hosting a show at the planetarium."
12,6,The Imitation Perturbation,25 Oct. 2018,8.2,2490,"When Wolowitz dresses up as Sheldon for Halloween, Sheldon seeks retaliation at Leonard and Penny's Halloween party. Also, Leonard is shocked that Penny doesn't remember their first kiss."
12,7,The Grant Allocation Derivation,1 Nov. 2018,7.3,1997,"Leonard is caught between a rock and a hard place when he's responsible for distributing extra grant money. Also, Bernadette turns the backyard playhouse into a hideaway from her husband and kids."
12,8,The Consummation Deviation,8 Nov. 2018,7.3,2032,"Sheldon tries to bond with Amy's father, but when Wolowitz lures Mr. Fowler away with magic tricks, Sheldon has no choice but to bond with Mrs. Fowler. Also, Koothrappali and Anu try to get physical for the first time."
12,9,The Citation Negation,15 Nov. 2018,7.2,2008,Sheldon and Amy are devastated after learning from a Russian paper that super asymmetry has already been theorized and disproved. Bernadette wants to beat Howard in a popular video game.
12,10,The VCR Illumination,6 Dec. 2018,7.5,2059,A VHS tape from Sheldon's past inspires him and Amy not to give up when they're still feeling down about their theory being disproven. Bernadette turns into a pageant mom when she tries to help Howard with his Magic Castle audition.
12,11,The Paintball Scattering,3 Jan. 2019,7.3,1973,"Penny and Leonard organize a paintball game, which results in mayhem when Sheldon becomes jealous of Amy. Raj catches Anu with her ex-boyfriend. Stuart doesn't want to move in with Denise."
12,12,The Propagation Proposition,10 Jan. 2019,7.1,1929,"Penny's ex-boyfriend Zack learns that he is infertile, so he asks Leonard for help; Koothrappali attempts to mend things with his ex-fiancee Anu."
12,13,The Confirmation Polarization,17 Jan. 2019,7.1,1941,"Sheldon and Amy are thrilled when their super asymmetry theory is proven by two physicists, until they try to kick Amy off the Nobel nomination. Bernadette gets one of her drugs approved and wants a reluctant Penny to head the sales team."
12,14,The Meteorite Manifestation,31 Jan. 2019,7.1,1932,Sheldon is thrilled to help Bernadette and Howard navigate bureaucracy concerning a neighbor's non-compliant balcony until he learns they too have ignored codes. Leonard is disappointed when his friends are uninterested in his new laser.
12,15,The Donation Oscillation,7 Feb. 2019,7.4,1994,"Penny tries to throw a wrench into Leonard's plan to be a sperm donor for her ex-boyfriend; Wolowitz, Bernadette, Anu and Koothrappali turn Koothrappali's canceled bachelor party into a couple's trip aboard the ""vomit comet."""
12,16,The D & D Vortex,21 Feb. 2019,7.9,2203,"The gang finds out Wil Wheaton hosts a celebrity Dungeons and Dragons game involving William Shatner, Joe Manganiello, Kareem Abdul-Jabbar and Kevin Smith. Deception and betrayal are the path to make it to the one open seat."
12,17,The Conference Valuation,7 Mar. 2019,7.1,1922,"Bernadette and Penny travel to San Diego for a pharmaceutical sales convention. Back home, Amy and the guys experiment on the Wolowitz children when Sheldon finds a book on it."
12,18,The Laureate Accumulation,4 Apr. 2019,7.1,1895,"Rivals Pemberton and Campbell charm America on a publicity tour so Sheldon and Amy try to win over Nobel laureates Kip Thorne, George Smoot and Frances Arnold. Halley's fear of the dark causes opportunity and conflict at the Wolowitz home."
12,19,The Inspiration Deprivation,18 Apr. 2019,7.0,1903,Contemplating what it would mean to all women if she were to win a Nobel Prize causes Amy to have a meltdown. Koothrappali and Wolowitz try to relive the good old days after Wolowitz buys a scooter that looks like the one he had years ago.
12,20,The Decision Reverberation,25 Apr. 2019,7.1,1888,Koothrappali is worried people won't take him seriously in his own field after publishing a paper that suggests he may have discovered alien life. Leonard wants to be the principal investigator on a plasma physics study.
12,21,The Plagiarism Schism,2 May 2019,7.2,1936,"Kripke has proof that Dr. Pemberton plagiarized his thesis in college, and Sheldon and Amy aren't sure if they should turn him in. Wolowitz learns that Bernadette wasn't the only waitress at the Cheesecake Factory who had a crush on him."
12,22,The Maternal Conclusion,9 May 2019,7.9,2411,"Leonard is pleasantly surprised when Beverly comes to visit and she's genuinely kind to him, until he finds out the real reason she's there. Also, Denise and Stuart overstay their welcome at the Wolowitz house."
12,23,The Change Constant,16 May 2019,9.0,4352,Sheldon and Amy await big news.
12,24,The Stockholm Syndrome,16 May 2019,9.5,8791,"Bernadette and Wolowitz leave their kids for the first time; Penny and Leonard try to keep a secret; Sheldon and Amy stick together; and Koothrappali makes a new friend, as the gang travels together into an uncharted future."
